{
  "schema_version": "career-learning-provider-research-v1",
  "locale": "es",
  "as_of_date": "2026-08-21",
  "state": "complete",
  "options": [
    {
      "option_id": "LP-001",
      "option_type": "course",
      "provider": "HashiCorp",
      "option": "Terraform course",
      "source_title": "Terraform course catalog",
      "source_date": "2026-08-20",
      "access_date": "2026-08-21",
      "source_state": "active",
      "url": "https://developer.hashicorp.com/terraform/tutorials",
      "geography": "online",
      "availability": "available",
      "current_cost": "sin costo indicado",
      "currency": "no indicada",
      "tax": "no indicado",
      "duration": "no indicada",
      "prerequisite": "no indicado",
      "renewal": "no aplica",
      "maintenance": "no indicada",
      "unknowns": "sin datos adicionales",
      "covered_signals": ["terraform"],
      "coverage_basis": "exact_technology_title"
    },
    {
      "option_id": "LP-002",
      "option_type": "course",
      "provider": "Argo Project",
      "option": "Argo starter course",
      "source_title": "Argo CD documentation",
      "source_date": "2026-08-20",
      "access_date": "2026-08-21",
      "source_state": "active",
      "url": "https://argo-cd.readthedocs.io/en/stable/",
      "geography": "online",
      "availability": "available",
      "current_cost": "sin costo indicado",
      "currency": "no indicada",
      "tax": "no indicado",
      "duration": "no indicada",
      "prerequisite": "no indicado",
      "renewal": "no aplica",
      "maintenance": "no indicada",
      "unknowns": "sin datos adicionales",
      "covered_signals": [],
      "coverage_basis": "explicit_curriculum"
    }
  ],
  "privacy_boundary": "public_provider_metadata_only",
  "no_external_action": true
}
